{
  "schemaVersion": "1.0",
  "packageId": "example-capability",
  "packageType": "capability",
  "version": "1.0.0",
  "starterSchemaVersion": "4.1.0",
  "moduleCode": "EXAMPLE",
  "summary": "Reusable capability baseline.",
  "features": {
    "required": [
      "core-feature"
    ],
    "optional": [
      "optional-feature"
    ]
  },
  "variables": {
    "OWNER": {
      "type": "string",
      "default": "Product & Engineering"
    },
    "POLICY_MODE": {
      "type": "enum",
      "values": [
        "a",
        "b"
      ],
      "default": "a"
    }
  },
  "constraints": [],
  "dependencies": [],
  "files": [
    {
      "source": "entities/core/module.md",
      "destination": "docs/02-modules/EXAMPLE/module.md",
      "code": "MOD-EXAMPLE",
      "type": "module",
      "feature": "core-feature"
    }
  ],
  "provenance": {
    "source": "capability-library"
  },
  "upgradePolicy": "manual-review"
}
